909821425481117696;2017-09-18 16:48:26;Queens, NY;40.7097931;-73.7949142;"""Making Strides Against Cancer"" walk at Flushing Meadow Park Please Hit The Link in our Bio that… https://t.co/rWJcnES1f2";[('Making', 'MISC'), ('Strides', 'MISC'), ('Against', 'MISC'), ('Cancer', 'MISC'), ('Flushing', 'LOCATION'), ('Meadow', 'LOCATION'), ('Park', 'LOCATION'), ('Link', 'ORGANIZATION'), ('Bio', 'PERSON')]
909821432233889792;2017-09-18 16:48:27;Manhattan, NY;40.780709;-73.9685415;@yashar Slavery...Coercion,Torture,Starvation,Imprisonment,Threats,PsychologicalAbuse G8 we reward member… https://t.co/WpOrJPsyzJ;[('Starvation', 'ORGANIZATION')]
909821438391148545;2017-09-18 16:48:29;Old Westbury, NY;40.786978;-73.595206;I really miss West Hempsteads gyro place 💔;[('West', 'LOCATION'), ('Hempsteads', 'LOCATION')]
909821443319332864;2017-09-18 16:48:30;Yonkers, NY;40.93;-73.9;current weather in Yonkers: haze, 73°F 73% humidity, wind 7mph, pressure 1020mb;[('Yonkers', 'LOCATION')]
909821445454393349;2017-09-18 16:48:30;Little Falls, NJ;40.876077;-74.22274250000001;Still wrapping my head around the fact that I actually found a campus that has worse parking than Salisbury 😶;[('Salisbury', 'PERSON')]
909821451607343104;2017-09-18 16:48:32;Queens, NY;40.6708795;-73.8311875;@PutinistaJonez Colin Farrell the GOAT though;[('Colin', 'PERSON'), ('Farrell', 'PERSON')]
909821451645177857;2017-09-18 16:48:32;New Jersey, USA;40.073040500000005;-74.7243235;@howellrebel @HOWELL_HOOPS @Howellbaseball  See where the Rebels are ranked in the APP Football Top 10  https://t.co/wuQnD6D6td;[('Rebels', 'MISC'), ('APP', 'MISC'), ('Football', 'MISC'), ('Top', 'MISC')]
909821452018384896;2017-09-18 16:48:32;New Brunswick, NJ;40.488195000000005;-74.4411045;A true legend like Carmelo Anthony would never https://t.co/S3GmckBunv;[('Carmelo', 'PERSON'), ('Anthony', 'PERSON')]
909821463296987136;2017-09-18 16:48:35;Brooklyn, NY;40.655138;-73.9487755;"""Your #indielabel needs a Facebook marketing plan: Here's why! . Visit https://t.co/jSfS11Da4v for more articles on… https://t.co/CiJ0HF5dbF";[('Facebook', 'MISC')]
909821468787306496;2017-09-18 16:48:36;Manhattan, NY;40.780709;-73.9685415;Leading @PC_WomensSoccer to two shutouts, Katie Day is the #BIGEASTwsoc Defensive Player of the Week! https://t.co/GzBZOq5egu;[('Katie', 'PERSON'), ('Day', 'PERSON'), ('#BIGEASTwsoc', 'ORGANIZATION'), ('Defensive', 'ORGANIZATION'), ('Player', 'ORGANIZATION'), ('of', 'ORGANIZATION'), ('the', 'ORGANIZATION'), ('Week', 'ORGANIZATION')]
909821489037430784;2017-09-18 16:48:41;Queens, NY;40.6708795;-73.8311875;.@SVABFAPHOTO alum Mohammid Walbrook @SURFER_Magazine on what it was like surviving Hurricane Irma on Barbuda… https://t.co/qvkeQ5E84M;[('Mohammid', 'PERSON'), ('Walbrook', 'PERSON'), ('Irma', 'PERSON'), ('Barbuda', 'LOCATION')]
909821503880990720;2017-09-18 16:48:44;Jersey City, NJ;40.7180015;-74.066663;The FGC is probably the most generous communities there are but can also have some people who are complete opposites of that;[('FGC', 'ORGANIZATION')]
909821505176928256;2017-09-18 16:48:45;Mineola, NY;40.7492678;-73.6406845;Can you recommend anyone for this #job? Sales Representative (Part time)- New Hyde Park, NY - https://t.co/84BYiJWSfH #photos #NowHiring;[('New', 'LOCATION'), ('Hyde', 'LOCATION'), ('Park', 'LOCATION'), ('NY', 'LOCATION')]
909821514370994176;2017-09-18 16:48:47;Manhattan, NY;40.780709;-73.9685415;Education & youth key: young people will solve future challenges AND will bear the brunt of today's inaction -@UNSDSN's C. Bahadur #ICSD2017;[('Bahadur', 'PERSON')]
909821520087736320;2017-09-18 16:48:48;Manhattan, NY;40.7571472;-73.97137735;Just posted a video @ NYSC Lexington Ave & 51st Street https://t.co/L9bsSxNls5;[('NYSC', 'ORGANIZATION'), ('Lexington', 'ORGANIZATION'), ('Ave', 'ORGANIZATION')]
909821528254140416;2017-09-18 16:48:50;Manhattan, NY;40.7553399;-73.98902;Listening to Ira Glass talk about radio journalism #iraglass… https://t.co/jYn4iaV9jM;[('Ira', 'MISC'), ('Glass', 'MISC')]
909821529734696971;2017-09-18 16:48:51;Floral Park, NY;40.7250765;-73.7053605;Definitely coming back to @themeadowsnyc next year !! Now on our way back to Reno 😩;[('Reno', 'PERSON')]
909821534172319746;2017-09-18 16:48:52;Manhattan, NY;40.780709;-73.9685415;My heart just broke. We all miss you Chester. https://t.co/l3muEHrt3c;[('Chester', 'PERSON')]
909821534520344582;2017-09-18 16:48:52;Manhattan, NY;40.780709;-73.9685415;Wait a min!!! Maria??? Where the fuck she cone from?? https://t.co/fahGyqLTlE;[('Maria', 'PERSON')]
909821540358918144;2017-09-18 16:48:53;Manhattan, NY;40.780709;-73.9685415;#EntertainmentNews: Check out the Complete List of winners from last night's #Emmys2017 via.@THR!… https://t.co/4T7NRomiE2;[('Complete', 'ORGANIZATION'), ('List', 'ORGANIZATION')]
909821552664788992;2017-09-18 16:48:56;Manhattan, NY;40.7127837;-74.0059413;We're #hiring! Click to apply: Property & Casualty Insurance -Consultant-NE - https://t.co/75z0K7ziRw #Consulting #NewYork, NY #Job #Jobs;[('Property', 'ORGANIZATION'), ('&', 'ORGANIZATION'), ('Casualty', 'ORGANIZATION'), ('Insurance', 'ORGANIZATION'), ('NY', 'LOCATION')]
909821553503641600;2017-09-18 16:48:56;Manhattan, NY;40.7555465;-73.9808543;If you're looking for work in #NewYork, NY, check out this #job: https://t.co/UE9DTUPymJ #Hiring #CareerArc;[('NY', 'LOCATION')]
909821561925980162;2017-09-18 16:48:58;Brooklyn, NY;40.706415;-73.950355;Mill House Cucumber Blessings cans now available. https://t.co/gvRcGGALkB @MillHouseBrewCo #BeerMenus;[('Mill', 'ORGANIZATION'), ('House', 'ORGANIZATION'), ('Cucumber', 'ORGANIZATION'), ('Blessings', 'ORGANIZATION')]
909821564698361856;2017-09-18 16:48:59;Manhattan, NY;40.780709;-73.9685415;I know but was quoted by a Microsoft staff at the #unga https://t.co/P0v0YrSwZZ;[('Microsoft', 'ORGANIZATION')]
909821575083433984;2017-09-18 16:49:01;Manhattan, NY;40.7142;-74.0064;🙌🏽 Lovin' this!!!! Fellow coach sharing the HerbaRemix of #bodakyellow 🎶 .... I do Herbalife,… https://t.co/70pjE0uKzm;[('Lovin', 'PERSON'), ('Herbalife', 'ORGANIZATION')]
909821575695929345;2017-09-18 16:49:01;Manhattan, NY;40.780709;-73.9685415;Netflix just sent these photos of Sean Spicer at their #emmys party out to press https://t.co/NBPRFYIWMo;[('Netflix', 'ORGANIZATION'), ('Sean', 'PERSON'), ('Spicer', 'PERSON')]
909821580531732481;2017-09-18 16:49:03;Bloomfield, NJ;40.7794765;-74.1876726;Want to work in #Bloomfield, NJ? View our latest opening: https://t.co/CrhBWyrr23 #CustomerService #Veterans #Job #Jobs #Hiring #CareerArc;[('NJ', 'LOCATION')]
909821584327696384;2017-09-18 16:49:04;West Caldwell, NJ;40.8409329;-74.3018154;Want to work in #WestCaldwell, NJ? View our latest opening: https://t.co/6b1Mq5PZ1G #publishing #Labor #Job #Jobs #Hiring;[('NJ', 'LOCATION')]
909821594557698048;2017-09-18 16:49:06;Manhattan, NY;40.780709;-73.9685415;It must be really easy to be he visual designer for Vineyard Vines stores bc the window display is always the goddamn same🤷🏻‍♀️🤷🏻‍♀️;[('Vineyard', 'ORGANIZATION'), ('Vines', 'ORGANIZATION')]
909821597137166336;2017-09-18 16:49:07;Manhattan, NY;40.780709;-73.9685415;@THR Slavery...Coercion,Torture,Starvation,Imprisonment,Threats,PsychologicalAbuse G8 we reward member… https://t.co/HVVpsIezk1;[('Starvation', 'ORGANIZATION')]
909821616065994752;2017-09-18 16:49:11;Manhattan, NY;40.732983;-74.008061;"7:30pm this Wednesday come see us perform in ""On One Condition"" at Dixon Place! Thank you so… https://t.co/llYe0htL55";[('Dixon', 'LOCATION'), ('Place', 'LOCATION')]
909821617412419585;2017-09-18 16:49:11;Paramus, NJ;40.917493;-74.077;I'm at @Gucci in Paramus, NJ https://t.co/X9sRbbWQVp;[('Paramus', 'LOCATION'), ('NJ', 'LOCATION')]
909821636291055616;2017-09-18 16:49:16;Manhattan, NY;40.780709;-73.9685415;"At UN High Level Meeting on Hurricane Irma response, @franceonu Min. urges us to ""get used to"" numerous large storms, prepare ahead.";[('UN', 'LOCATION'), ('Irma', 'PERSON')]
909821639038136320;2017-09-18 16:49:17;Bayonne, NJ;40.67;-74.12;current weather in Bayonne: haze, 72°F 73% humidity, wind 5mph, pressure 1020mb;[('Bayonne', 'LOCATION')]
909821641957486597;2017-09-18 16:49:17;Queens, NY;40.74757;-73.85614;Shawty gets what shawtyy wants ❤️#themeadowsnyc @ The Meadows Music… https://t.co/YTKdWUWfyQ;[('Meadows', 'ORGANIZATION'), ('Music', 'ORGANIZATION')]
909821645568831488;2017-09-18 16:49:18;Whippany, NJ;40.817411;-74.419489;Jesse Marsch announces Ryan Meara will start in the @opencup final.   #USOC2017 | #RBNY;[('Jesse', 'PERSON'), ('Marsch', 'PERSON'), ('Ryan', 'PERSON'), ('Meara', 'PERSON')]
909821655559544832;2017-09-18 16:49:21;Manhattan, NY;40.7127837;-74.0059413;Want to work at JDHuntr In-House Jobs ? We're #hiring in #VariousUSCities, US! Click for details: https://t.co/hAJj2aDd4B #Legal #Job;[('JDHuntr', 'LOCATION'), ('US', 'LOCATION')]
909821666523537408;2017-09-18 16:49:23;Brooklyn, NY;40.655138;-73.9487755;YEAH I BE SMOKIN, BITCH MY BIC BIGGER THAN YER BF DICK. COME SUK 🅰️ PHAT 🅱️LUNT. #CHUD;[('SMOKIN', 'LOCATION'), ('BITCH', 'ORGANIZATION'), ('BIC', 'ORGANIZATION'), ('DICK', 'PERSON'), ('LUNT', 'PERSON')]
909821671745265664;2017-09-18 16:49:24;Massachusetts, USA;42.5481714;-71.1724467;Want to work at Kelly Services? We're #hiring in #Wilmington, MA! Click for details: https://t.co/iZBSMsloDo #KellyJobs #KellyServices;[('Kelly', 'LOCATION'), ('Services', 'LOCATION'), ('MA', 'LOCATION')]
909821672768856064;2017-09-18 16:49:25;Manhattan, NY;40.780709;-73.9685415;@LarrySoprano I hope we see 7 on the line more often to give Eli more time but we all  Mac will leave his tackles o… https://t.co/9zh7nEVs6U;[('Eli', 'PERSON'), ('Mac', 'PERSON')]
909821672462700545;2017-09-18 16:49:25;Manhattan, NY;40.780709;-73.9685415;@WinrockIntl our colleague Amit Bando emphasizing local governance and capacity development #Concordia17 needed for… https://t.co/i7obplD7YK;[('Amit', 'PERSON'), ('Bando', 'PERSON')]
909821675071455232;2017-09-18 16:49:25;Manhattan, NY;40.71;-74.01;current weather in New York: haze, 72°F 73% humidity, wind 7mph, pressure 1020mb;[('New', 'LOCATION'), ('York', 'LOCATION')]
909821686668840960;2017-09-18 16:49:28;Hempstead, NY;40.702939;-73.62090699999999;LMAO WHY IS BE SINGING https://t.co/ySue7uNqDC;[('LMAO', 'ORGANIZATION')]
909821692289191942;2017-09-18 16:49:29;Englewood Cliffs, NJ;40.87563844;-73.94674301;Spectacular view... #nofilter @ The Snack Shack/Englewood Boat Basin https://t.co/Sedkp9Ox2h;[('Snack', 'LOCATION'), ('Shack', 'LOCATION'), ('Englewood', 'LOCATION'), ('Boat', 'LOCATION'), ('Basin', 'LOCATION')]
909821694444961792;2017-09-18 16:49:30;Connecticut, USA;41.91134973;-72.95710862;#myview #connecticut @ Barkhampsted Dam https://t.co/FcqFbfTxzP;[('Barkhampsted', 'PERSON'), ('Dam', 'PERSON')]
909821699243352064;2017-09-18 16:49:31;West Long Branch, NJ;40.288591499999995;-74.019204;@dave_pburg Hi Dave, can you send me a DM whenever you get a chance please thank you;[('Dave', 'PERSON')]
909821702150004737;2017-09-18 16:49:32;Manhattan, NY;40.780709;-73.9685415;@mogui_viki BTW are those Egyptian Hieroglyphs I see on there?;[('Egyptian', 'MISC')]
909821704859418624;2017-09-18 16:49:32;Manhattan, NY;40.780709;-73.9685415;I'm generalizing but I live in New York. MTA bus drivers are very competent. Tour bus drivers are not https://t.co/b0JWblAOyn;[('New', 'LOCATION'), ('York', 'LOCATION'), ('MTA', 'ORGANIZATION')]
909821704469450753;2017-09-18 16:49:32;Manhattan, NY;40.780709;-73.9685415;"Chicago artist @FamousDex releases the official video for ""I Got 50,"" directed by @LewisYouNasty:… https://t.co/ajUGpoM2Ch";[('Chicago', 'LOCATION')]
909821713533116418;2017-09-18 16:49:34;Paterson, NJ;40.92;-74.17;current weather in Paterson: haze, 73°F 73% humidity, wind 5mph, pressure 1020mb;[('Paterson', 'LOCATION')]
909821713436770304;2017-09-18 16:49:34;Robertsville, NJ;40.342915500000004;-74.294061;Boys will travel to Boro today for a 4pm kickoff.   #hardworkbeatstalent;[('Boro', 'LOCATION')]
909821715609473025;2017-09-18 16:49:35;Manhattan, NY;40.780709;-73.9685415;@HananyaNaftali Children in Israel's schools are force fed Zionism. He's a victim of colonialism. His brainwashed… https://t.co/7JJhYvUz8t;[('Zionism', 'MISC')]
909821720323854336;2017-09-18 16:49:36;Manhattan, NY;40.7571472;-73.97137735;Just posted a photo @ NYSC Lexington Ave & 51st Street https://t.co/E48LtXFu6h;[('NYSC', 'ORGANIZATION'), ('Lexington', 'ORGANIZATION'), ('Ave', 'ORGANIZATION')]
909821732583862272;2017-09-18 16:49:39;Brooklyn, NY;40.655138;-73.9487755;@FuckBoodie Hapoy Flee Day bruh bruh 🤘🏽🍃🍾;[('Hapoy', 'MISC'), ('Flee', 'MISC'), ('Day', 'MISC')]
909821737914834944;2017-09-18 16:49:40;Manhattan, NY;40.80991;-73.95013;This weekend was Blessed Building with my Gods !  #Harlem the mecca out here with the gods just… https://t.co/Ri07PT8ggj;[('Blessed', 'ORGANIZATION'), ('Building', 'ORGANIZATION')]
909821748597612544;2017-09-18 16:49:43;Newark, NJ;40.73;-74.17;current weather in Newark: haze, 72°F 73% humidity, wind 5mph, pressure 1020mb;[('Newark', 'LOCATION')]
909821720403628033;2017-09-18 16:49:36;Stamford, CT;41.0983345;-73.554097;@GCarroll77 @realkevinkelly Nice!;[('Nice', 'ORGANIZATION')]
909821760723460097;2017-09-18 16:49:46;Hicksville, NY;40.7681405;-73.5300925;#Emmys were yesterday, but if Aya Cash doesn't get a 2018 nod for screaming HEY! DOT. DOT. DOT. on #YoureTheWorst nothing means anything.;[('Aya', 'PERSON'), ('Cash', 'PERSON')]
909821767669157890;2017-09-18 16:49:47;Rahway, NJ;40.6098335;-74.280358;Rebecca top 3 after Susan and Becky https://t.co/Pc7GRMZYVQ;[('Rebecca', 'PERSON'), ('Susan', 'PERSON'), ('Becky', 'PERSON'), ('https:t.coPc7GRMZYVQ', 'PERSON')]
909821778071031811;2017-09-18 16:49:50;Manhattan, NY;40.780709;-73.9685415;FW at Vineyard Vines is just the same shit but with a cardigan and duck boots 🙄;[('FW', 'ORGANIZATION'), ('Vineyard', 'LOCATION'), ('Vines', 'LOCATION')]
909821778356260865;2017-09-18 16:49:50;Manhattan, NY;40.780709;-73.9685415;"@THR DavidMiscavige ""TookCareOf"" all highr staf membrs 2become head of Scientology Agnst LRH instrctns HoleTortureP… https://t.co/FC4589w8SA";[('DavidMiscavige', 'ORGANIZATION'), ('Scientology', 'ORGANIZATION'), ('Agnst', 'ORGANIZATION'), ('LRH', 'ORGANIZATION')]
909821779639750659;2017-09-18 16:49:50;New York, USA;42.8166;-73.766899;"Incident on #I87Northway NB at Exit 8; Crescent Road https://t.co/6UhAGpibMh";[('Crescent', 'LOCATION'), ('Road', 'LOCATION')]
909821779639701504;2017-09-18 16:49:50;New York, USA;42.8166;-73.766899;"Incident on #I87Northway NB at Exit 8; Crescent Road https://t.co/mHsAhaGhQx";[('Crescent', 'LOCATION'), ('Road', 'LOCATION')]
909821781430738945;2017-09-18 16:49:51;Brooklyn, NY;40.706415;-73.950355;Southern Tier Choklat bottles now available. https://t.co/iRt8ZvLTZs @stbcbeer #BeerMenus;[('Southern', 'ORGANIZATION'), ('Tier', 'ORGANIZATION'), ('Choklat', 'ORGANIZATION')]
909821782080786432;2017-09-18 16:49:51;Manhattan, NY;40.780709;-73.9685415;"Niggas Be Asking Girls ""What U Like To Do"" But NEVER Take Em To Go Do It";[('Niggas', 'MISC'), ('Be', 'MISC'), ('Asking', 'MISC'), ('Girls', 'MISC'), ('NEVER', 'MISC'), ('Take', 'MISC'), ('Em', 'MISC')]
909821783527657472;2017-09-18 16:49:51;Jersey City, NJ;40.72;-74.04;current weather in Jersey City: haze, 72°F 73% humidity, wind 7mph, pressure 1020mb;[('Jersey', 'LOCATION'), ('City', 'LOCATION')]
909821792218468352;2017-09-18 16:49:53;Queens, NY;40.6708795;-73.8311875;@James_K_Dubbs21 @JayGold42 HA! Might get all things Kyrie lol https://t.co/vmARsR6BVi;[('HA', 'LOCATION'), ('Kyrie', 'PERSON')]
909821793761972226;2017-09-18 16:49:53;Manhattan, NY;40.780709;-73.9685415;180 minutes of action, and not a goal allowed!   @PC_WomensSoccer's Shelby Hogan is the #BIGEASTwsoc Goalkeeper of… https://t.co/yZkWq82Ens;[('Shelby', 'PERSON'), ('Hogan', 'PERSON')]
909821800590315520;2017-09-18 16:49:55;Freeport, NY;40.648987000000005;-73.5842655;Remember this happening to me repeatedly using '96 Jordan that one time you beat me? @ItsSwayBro https://t.co/SoRE72YKgx;[('Jordan', 'LOCATION')]
909821805069832192;2017-09-18 16:49:56;Manhattan, NY;40.780709;-73.9685415;"President Trump told reporters outside his inaugural UN meeting that he would soon ""make the United Nations great""";[('Trump', 'PERSON'), ('UN', 'ORGANIZATION'), ('United', 'ORGANIZATION'), ('Nations', 'ORGANIZATION')]
909821805388378112;2017-09-18 16:49:56;White Plains, NY;41.0339862;-73.7629097;Join the CVS Health team! See our latest #job opening here: https://t.co/cCcbEkmLBN #Labor #WhitePlains, NY #Hiring #CareerArc;[('CVS', 'ORGANIZATION'), ('Health', 'ORGANIZATION'), ('NY', 'LOCATION')]
909821811633815552;2017-09-18 16:49:58;Hicksville, NY;40.7681405;-73.5300925;@Crowdtappers @Clarissa_xplain OH YEAH! YAHOOOO #SplendaNaturals #Emmy #ad;[('YAHOOO', 'ORGANIZATION')]
909821819103744001;2017-09-18 16:50:00;Belleville, NJ;40.79;-74.15;current weather in Belleville: haze, 72°F 73% humidity, wind 5mph, pressure 1020mb;[('Belleville', 'LOCATION')]
909821827274477568;2017-09-18 16:50:01;Hempstead, NY;40.702939;-73.62090699999999;LMAO WHY IS HE FUCKING SINGING https://t.co/ySue7uNqDC;[('LMAO', 'ORGANIZATION')]
909821829258383362;2017-09-18 16:50:02;Manhattan, NY;40.780709;-73.9685415;@mogui_viki SCREAMS!!!! I LOVE it wish it was my bedroom door! gotta write 'The Witch is in' on it!;[('Witch', 'MISC')]
909821852255649793;2017-09-18 16:50:07;Bronx, NY;40.81036;-73.90448;July 18, 2017: 880 East 147 St, Mott Haven/Port Morris, the Bronx – $1,100,000 – 1 unit – 1,560 sf – one family home;[('Mott', 'PERSON'), ('Haven', 'PERSON'), ('Morris', 'PERSON'), ('Bronx', 'LOCATION')]
909821856131059712;2017-09-18 16:50:08;Manhattan, NY;40.76147952;-73.977177;#newyorkcity #moma #art @ MoMA The Museum of Modern Art https://t.co/3PCC6jtmUs;[('MoMA', 'ORGANIZATION'), ('Museum', 'ORGANIZATION'), ('of', 'ORGANIZATION'), ('Modern', 'ORGANIZATION'), ('Art', 'ORGANIZATION')]
909821856210915329;2017-09-18 16:50:08;Bronx, NY;40.8503475;-73.8494415;Deliver us from evil - BFMV.;[('BFMV', 'PERSON')]
909821856391270400;2017-09-18 16:50:08;Manhattan, NY;40.780709;-73.9685415;#SoftDrinkMovies Warm Milk;[('Warm', 'ORGANIZATION'), ('Milk', 'ORGANIZATION')]
909821856139669506;2017-09-18 16:50:08;Midtown South, Manhattan;40.747146;-73.9888565;".@Lane_Kiffin to Sean White: ""Sup?"" https://t.co/0nmyU6hLc0";[('Sean', 'PERSON'), ('White', 'PERSON')]
909821863131480065;2017-09-18 16:50:10;Manhattan, NY;40.780709;-73.9685415;@RyanRuocco @sarahkustok @NetsOnYES This move puts @RyanRuocco  @sarahkustok & Ian (Team Announcers) as the odds-on… https://t.co/KoLzAAsM3K;[('Ian', 'PERSON')]
909821864008183809;2017-09-18 16:50:10;New Jersey, USA;40.073040500000005;-74.7243235;@WAVEPRIDE @LBpublicschools @LB_WaveBaseball   See where Long Branch is ranked in the APP Football Top 10  https://t.co/wuQnD6D6td;[('Long', 'LOCATION'), ('Branch', 'LOCATION'), ('APP', 'MISC'), ('Football', 'MISC'), ('Top', 'MISC')]
909821864742187010;2017-09-18 16:50:10;Queens, NY;40.6708795;-73.8311875;Herrrrd u ma https://t.co/aH7bDeryDc;[('Herrrd', 'ORGANIZATION')]
909821871021072384;2017-09-18 16:50:12;Queens, NY;40.6708795;-73.8311875;I revisited 'Teflon Don' this weekend and this song here. Can't tell me I'm not about that life when it comes on. https://t.co/WG9CP7hM6g;[('Don', 'PERSON')]
909821881485627393;2017-09-18 16:50:14;Ridgefield, NJ;40.8342669;-74.0087505;We're #hiring! Click to apply: Barista - https://t.co/n9vLhiHSRo #barista #Barista #Ridgefield, NJ #Job #Jobs;[('Barista', 'ORGANIZATION'), ('NJ', 'LOCATION')]
909821914490769410;2017-09-18 16:50:22;Manhattan, NY;40.780709;-73.9685415;So if the patriots win can I still get free coffee and donut in NYC? If I show my ID? It says Boston!!  Lmao help @DunkinDonuts;[('Boston', 'ORGANIZATION'), ('Lmao', 'ORGANIZATION')]
909821921071648768;2017-09-18 16:50:24;New Jersey, USA;40.073040500000005;-74.7243235;Never in my life would I imagine KOF players would get to be on the national team and compete in  large sports even… https://t.co/qVAp9fGBsJ;[('KOF', 'ORGANIZATION')]
909821928856109056;2017-09-18 16:50:26;Sayreville, NJ;40.47;-74.36;current weather in Sayreville: haze, 72°F 73% humidity, wind 11mph, pressure 1020mb;[('Sayreville', 'LOCATION')]
909821944769449984;2017-09-18 16:50:29;Queens, NY;40.6708795;-73.8311875;Dear Taxi Limosine And Commision New York City  Please increase the Rates  مہنگائی بڑھ چکی ہے https://t.co/qOdg1E0sWI;[('Dear', 'ORGANIZATION'), ('Taxi', 'ORGANIZATION'), ('Limosine', 'ORGANIZATION'), ('And', 'ORGANIZATION'), ('Commision', 'ORGANIZATION'), ('New', 'ORGANIZATION'), ('York', 'ORGANIZATION'), ('City', 'ORGANIZATION'), ('Please', 'ORGANIZATION')]
909821950167527424;2017-09-18 16:50:31;Manhattan, NY;40.72988718;-73.99608036;My glasses are enormous.  https://t.co/63OLOWu0lg @ New York… https://t.co/9PsSQ7NF3X;[('New', 'LOCATION'), ('York', 'LOCATION')]
909821960053501953;2017-09-18 16:50:33;Manhattan, NY;40.780709;-73.9685415;Shut out to all the #virgos this week!!! #happybirthday..LETS TURN UP THIS WEEK!!!!!  Letssgoooo;[('Letssgooo', 'ORGANIZATION')]
909821963392167936;2017-09-18 16:50:34;Brooklyn, NY;40.655138;-73.9487755;Poor delusional Hillary. The town crier . https://t.co/jZxyx8CYt8;[('Hillary', 'PERSON')]
909821964809789440;2017-09-18 16:50:34;Livingston, NJ;40.7862871;-74.3300842;This #job might be a great fit for you: Registered Nurse (RN) The Infusion Center Per Diem Day - https://t.co/BPjZNvnBic #Nursing #Hiring;[('Infusion', 'MISC'), ('Center', 'MISC'), ('Per', 'MISC'), ('Diem', 'MISC'), ('Day', 'MISC')]
909821965023592448;2017-09-18 16:50:34;Newark, NJ;40.735657;-74.1723667;Join the Cognizant team! See our latest #job opening here: https://t.co/vky9Y7PGaQ #IT #Newark, NJ #Hiring #CareerArc;[('NJ', 'LOCATION')]
909821977355005952;2017-09-18 16:50:37;Brooklyn, NY;40.655138;-73.9487755;"Key indication of how STRONG the brand is, ""I No Fuckin Baby"" is on WSHH and co-starring on IG skits now. @bodegaboysdaily @BodegaBoys";[('Fuckin', 'ORGANIZATION'), ('Baby', 'ORGANIZATION'), ('WSHH', 'ORGANIZATION')]
909821976620957702;2017-09-18 16:50:37;Manhattan, NY;40.780709;-73.9685415;"""Reinventing Fashion With Function"" - https://t.co/0MiCUPN1ts / Source: @PSFK / @LoomiaCo ❤️ what you are doing! https://t.co/oaBpVGhdC4";[('Reinventing', 'MISC'), ('Fashion', 'MISC'), ('With', 'MISC'), ('Function', 'MISC')]
909821991754063872;2017-09-18 16:50:41;Brooklyn, NY;40.67669;-74.01387;May your Monday be golden! #honeybunny @ Foxy & Winston https://t.co/QbpgLHJsvT;[('Foxy', 'ORGANIZATION'), ('&', 'ORGANIZATION'), ('Winston', 'ORGANIZATION')]
909821993767272448;2017-09-18 16:50:41;Manhattan, NY;40.780709;-73.9685415;@stephenasmith I just read your interview with #KyrieIrving WTF was that all about? Kyrie is right, #WhoCares Good move Kyrie wish-u-da-bes!;[('WTF', 'ORGANIZATION'), ('Kyrie', 'PERSON'), ('Kyrie', 'PERSON')]
909821993658273793;2017-09-18 16:50:41;Manhattan, NY;40.74535;-73.97819;It was a brunch to remember... Or so I was told (📸: @ivywaisbord) @ The Flying Cock NYC https://t.co/s98MFZlZCn;[('Flying', 'ORGANIZATION'), ('Cock', 'ORGANIZATION'), ('NYC', 'ORGANIZATION')]
909822002172710912;2017-09-18 16:50:43;Manhattan, NY;40.780709;-73.9685415;I tried the Ramen Burger for the first time this weekend...so overrated;[('Ramen', 'ORGANIZATION'), ('Burger', 'ORGANIZATION')]
909822004387287043;2017-09-18 16:50:44;Queens, NY;40.6708795;-73.8311875;For This Life I Cannot Changee https://t.co/cJHPCo4PE0;[('Changee', 'PERSON')]
909822037652369413;2017-09-18 16:50:52;Manhattan, NY;40.780709;-73.9685415;@jk_rowling OMG!! we both had one! but that looks like the creepy thing from Harry Potter faux Moody tortures;[('OMG', 'ORGANIZATION'), ('Harry', 'PERSON'), ('Potter', 'PERSON'), ('Moody', 'PERSON')]
909822040894529537;2017-09-18 16:50:52;Manhattan, NY;40.780709;-73.9685415;@ShaunKing I made an FBI report, if that helps any...;[('FBI', 'ORGANIZATION')]
909822040055648257;2017-09-18 16:50:52;Manhattan, NY;40.780709;-73.9685415;The Blueprint: How Stadium Goods' John McPheters Created A Sneaker Consignment Empire @N_C_B https://t.co/fjihlyaPZv https://t.co/v36ABHCF0v;[('How', 'LOCATION'), ('Stadium', 'LOCATION'), ('Goods', 'LOCATION'), ('John', 'PERSON'), ('McPheters', 'PERSON')]
909822052764471296;2017-09-18 16:50:55;Jersey City, NJ;40.7180015;-74.066663;On behalf of #NationalCheeseburgerDay we are running a contest on Instagram you should check it out!!!;[('Instagram', 'LOCATION')]
909822057780776961;2017-09-18 16:50:56;Connecticut, USA;41.500753;-72.757385;@maureenjohnson he's the president, Americans aren't going anywhere in general.;[('Americans', 'MISC')]
909822059315908609;2017-09-18 16:50:57;Manhattan, NY;40.780709;-73.9685415;I think the Giants lose 20-7 and the season is effectively over;[('Giants', 'ORGANIZATION')]
909822065691316229;2017-09-18 16:50:58;Manhattan, NY;40.780709;-73.9685415;I need to type out a script as a response for when ppl ask me why i wanna b a Mortician. That'll save mad time & energy 😩;[('Mortician', 'MISC')]
909822086821978112;2017-09-18 16:51:03;East Brunswick, NJ;40.42;-74.42;current weather in East Brunswick: light rain, 72°F 73% humidity, wind 11mph, pressure 1020mb;[('East', 'LOCATION'), ('Brunswick', 'LOCATION')]
909822097488318464;2017-09-18 16:51:06;Bronx, NY;40.8503475;-73.8494415;ALL THESE SOCIAL NETWORKS AND THESE COMPUTERS GOT THESE NIGGAS RUNNIN' AROUND LIKE THEY SOME SHOOTAS 😴😴;[('NIGGAS', 'ORGANIZATION'), ('RUNNIN', 'ORGANIZATION')]
909822104970899456;2017-09-18 16:51:08;Manhattan, NY;40.780709;-73.9685415;We commend SG @AntonioGuterres & his call for UN to focus more on people & less on bureaucracy. #USAatUNGA #UNGA  https://t.co/rEOVnQil3S;[('SG', 'ORGANIZATION'), ('&', 'ORGANIZATION'), ('UN', 'ORGANIZATION')]
